{
  "id": "b8a5dadcc5104ebe",
  "slug": "ea-scalper-xauusd",
  "name": "EA_SCALPER_XAUUSD",
  "description": "Automated XAUUSD (Gold) Trading Robot for Prop Firms (Apex & FTMO) | MQL5 + NautilusTrader (Python) | SMC, ML Regime Detection, ONNX | Built after analyzing 5000+ trading bots - no scams, no BS",
  "author": "francomascareloai",
  "authorAvatar": "https://avatars.githubusercontent.com/u/211371764?v=4",
  "repoUrl": "https://github.com/francomascareloai/EA_SCALPER_XAUUSD",
  "repoFullName": "francomascareloai/EA_SCALPER_XAUUSD",
  "stars": 19,
  "forks": 7,
  "category": "automation",
  "categories": [
    "automation"
  ],
  "tags": [
    "algorithmic-trading",
    "ftmo",
    "gold-trading",
    "machine-learning",
    "metatrader5",
    "mql5",
    "nautilustrader",
    "prop-firm",
    "python-trading",
    "trading-bot",
    "xauusd"
  ],
  "tier": 3,
  "status": "active",
  "createdAt": "2025-08-12T15:43:59Z",
  "updatedAt": "2025-12-23T01:13:14Z",
  "lastCommitAt": "2025-12-23T01:13:11Z",
  "source": "github-search",
  "collectedAt": "2025-12-23T03:46:39.829Z",
  "authorUrl": "https://github.com/francomascareloai",
  "license": null,
  "readme": "# EA_SCALPER_XAUUSD v3.30\r\n\r\n[![Python](https://img.shields.io/badge/Python-3.10+-blue.svg)](https://python.org)\r\n[![MQL5](https://img.shields.io/badge/MQL5-MetaTrader%205-orange.svg)](https://www.mql5.com)\r\n[![NautilusTrader](https://img.shields.io/badge/NautilusTrader-Migration-green.svg)](https://nautilustrader.io)\r\n[![License](https://img.shields.io/badge/License-Personal%20Project-lightgrey.svg)]()\r\n[![Status](https://img.shields.io/badge/Status-In%20Development-red.svg)]()\r\n\r\n**Automated Gold Trading System for Prop Firms (Apex Trader Funding & FTMO)**\r\n\r\n**Dataset ativo para backtests:** `data/raw/full_parquet/xauusd_2003_2025_stride20_full.parquet` (32.7M ticks, 2003-05-05 â†’ 2025-11-28, stride 20). Todas as execuÃ§Ãµes devem usar este arquivo.\r\n\r\n> After many requests and messages, I've made this repository public again. This is a personal project that I've been developing to automate gold (XAUUSD) trading with a focus on prop firm challenges (Apex Trader Funding, FTMO, and others).\r\n\r\n---\r\n\r\n## ğŸš¨ NOT READY FOR PRODUCTION\r\n\r\n> **âš ï¸ WARNING: This project is NOT ready for live trading with real money!**\r\n> \r\n> I am actively fixing bugs and improving the system. Use only for:\r\n> - ğŸ“š **Study and learning**\r\n> - ğŸ§ª **Demo account testing**\r\n> - ğŸ”¬ **Backtesting and research**\r\n>\r\n> **DO NOT use on funded accounts or real money until further notice.**\r\n\r\n### Known Issues & Bugs Being Fixed\r\n\r\n| Issue | Status | Description |\r\n|-------|--------|-------------|\r\n| Filters too strict | ğŸ”§ Fixing | May result in very few or no trades |\r\n| ONNX model path | ğŸ”§ Fixing | Model may not load on some setups |\r\n| Compilation warnings | âœ… Fixed | Deprecated functions removed |\r\n| Duplicate structs | âœ… Fixed | SConsolidation duplicate removed |\r\n\r\n### Found a Bug? Have a Suggestion?\r\n\r\n- ğŸ“¬ **Telegram**: [@novtelfran](https://t.me/novtelfran) (fastest response)\r\n- ğŸ› **GitHub Issues**: Open an issue with details\r\n- ğŸ’¬ **Discussions**: Start a discussion for questions/ideas\r\n\r\n**Please include**: MT5 version, broker, timeframe, logs/screenshots if possible.\r\n\r\n---\r\n\r\n## ğŸ“‘ Table of Contents\r\n\r\n- [The Origin Story](#the-origin-story)\r\n- [Overview](#overview)\r\n- [Two Versions Available](#two-versions-available)\r\n- [Quick Start](#quick-start)\r\n- [For Students & Researchers](#for-students--researchers)\r\n- [System Architecture](#system-architecture)\r\n- [Trading Strategies](#trading-strategies)\r\n- [Analysis Modules (MQL5)](#analysis-modules-mql5)\r\n- [Risk Management](#risk-management)\r\n- [Machine Learning Integration](#machine-learning-integration)\r\n- [NautilusTrader Migration (Python)](#nautilustrader-migration-python)\r\n- [Project Structure](#project-structure)\r\n- [Target Performance (Theoretical)](#target-performance-theoretical)\r\n- [Roadmap](#roadmap)\r\n- [Requirements](#requirements)\r\n- [Disclaimer](#disclaimer)\r\n- [Contact & Contributions](#contact--contributions)\r\n- [Version History](#version-history)\r\n\r\n---\r\n\r\n## The Origin Story\r\n\r\nThis project started after I **downloaded and classified over 5,000 trading robots** from 90%+ of Telegram groups and channels about Trading and Expert Advisors. After extensive testing and analysis, I realized that **99.9% of trading bots are garbage** - either poorly coded, overfitted, or outright scams from vendors trying to steal your money.\r\n\r\n**No scammers. No fake vendors. No bullshit.**\r\n\r\nI decided to build my own robot from scratch, with proper backtesting, statistical validation, and real risk management. This is that journey.\r\n\r\n---\r\n\r\n## Overview\r\n\r\nEA_SCALPER_XAUUSD is an advanced Expert Advisor (trading robot) designed specifically for **XAUUSD (Gold)** scalping on MetaTrader 5. It combines:\r\n\r\n- **Smart Money Concepts (SMC)** - Institutional trading methodology\r\n- **Machine Learning (ONNX)** - Direction models trained in Python\r\n- **Multi-Timeframe Analysis (MTF)** - H1/M15/M5 for maximum precision\r\n- **Order Flow Analysis** - Footprint/Cluster chart style confirmation\r\n- **Prop Firm Compliance** - Strict rules for FTMO/Apex\r\n\r\n---\r\n\r\n## Two Versions Available\r\n\r\nThis project has **two separate implementations** for different use cases:\r\n\r\n### Version 1: MQL5 Only (MetaTrader 5)\r\n\r\n```\r\nğŸ“ MQL5/\r\nâ”œâ”€â”€ Experts/EA_SCALPER_XAUUSD.mq5    # Main robot\r\nâ””â”€â”€ Include/EA_SCALPER/              # All modules\r\n```\r\n\r\n| Aspect | Details |\r\n|--------|---------|\r\n| **Platform** | MetaTrader 5 |\r\n| **Broker** | Any MT5 broker with XAUUSD |\r\n| **Prop Firms** | FTMO, MyForexFunds, etc. |\r\n| **Status** | ğŸ”§ **In Development** (fixing bugs) |\r\n| **Best For** | Study, demo testing, backtesting |\r\n\r\n### Version 2: Python + NautilusTrader (Futures)\r\n\r\n```\r\nğŸ“ nautilus_gold_scalper/\r\nâ”œâ”€â”€ src/                             # Python modules\r\nâ””â”€â”€ scripts/                         # Backtest runners\r\n```\r\n\r\n| Aspect | Details |\r\n|--------|---------|\r\n| **Platform** | NautilusTrader â†’ NinjaTrader/Tradovate |\r\n| **Broker** | Tradovate (via Apex Trader Funding) |\r\n| **Prop Firms** | Apex Trader Funding (Futures) |\r\n| **Status** | ğŸ”„ **In Development** |\r\n| **Best For** | Futures trading on Apex |\r\n\r\n### Which Version Should I Use?\r\n\r\n```\r\nâ”Œâ”€â”€â”€â”€â”€â”€â”€â”€â”€â”€â”€â”€â”€â”€â”€â”€â”€â”€â”€â”€â”€â”€â”€â”€â”€â”€â”€â”€â”€â”€â”€â”€â”€â”€â”€â”€â”€â”€â”€â”€â”€â”€â”€â”€â”€â”€â”€â”€â”€â”€â”€â”€â”€â”€â”€â”€â”€â”€â”€â”€â”€â”€â”€â”€â”€â”€â”€â”€â”€â”€â”€â”€â”€â”€â”€â”€â”€â”\r\nâ”‚                         WHICH VERSION TO USE?                               â”‚\r\nâ”œâ”€â”€â”€â”€â”€â”€â”€â”€â”€â”€â”€â”€â”€â”€â”€â”€â”€â”€â”€â”€â”€â”€â”€â”€â”€â”€â”€â”€â”€â”€â”€â”€â”€â”€â”€â”€â”€â”€â”€â”€â”€â”€â”€â”€â”€â”€â”€â”€â”€â”€â”€â”€â”€â”€â”€â”€â”€â”€â”€â”€â”€â”€â”€â”€â”€â”€â”€â”€â”€â”€â”€â”€â”€â”€â”€â”€â”€â”¤\r\nâ”‚                                                                             â”‚\r\nâ”‚   Want to trade FOREX/CFD on MT5?                                          â”‚\r\nâ”‚   â””â”€â”€â–¶ Use MQL5 Version (FTMO, MyForexFunds, etc.)                        â”‚\r\nâ”‚                                                                             â”‚\r\nâ”‚   Want to trade FUTURES on Apex Trader Funding?                            â”‚\r\nâ”‚   â””â”€â”€â–¶ Use Python/NautilusTrader Version (via NinjaTrader/Tradovate)      â”‚\r\nâ”‚                                                                             â”‚\r\nâ”‚   Want to study the code and learn?                                        â”‚\r\nâ”‚   â””â”€â”€â–¶ Both! MQL5 is complete, Python shows modern architecture           â”‚\r\nâ”‚                                                                             â”‚\r\nâ””â”€â”€â”€â”€â”€â”€â”€â”€â”€â”€â”€â”€â”€â”€â”€â”€â”€â”€â”€â”€â”€â”€â”€â”€â”€â”€â”€â”€â”€â”€â”€â”€â”€â”€â”€â”€â”€â”€â”€â”€â”€â”€â”€â”€â”€â”€â”€â”€â”€â”€â”€â”€â”€â”€â”€â”€â”€â”€â”€â”€â”€â”€â”€â”€â”€â”€â”€â”€â”€â”€â”€â”€â”€â”€â”€â”€â”€â”˜\r\n```\r\n\r\n---\r\n\r\n## Quick Start\r\n\r\n### Option A: Run on MetaTrader 5 (MQL5 Version)\r\n\r\n**Step 1: Install MetaTrader 5**\r\n- Download from your broker or [MetaQuotes](https://www.metatrader5.com)\r\n- Create demo account with XAUUSD access\r\n\r\n**Step 2: Copy Files**\r\n```\r\nCopy entire MQL5/ folder to:\r\nC:\\Users\\[YourUser]\\AppData\\Roaming\\MetaQuotes\\Terminal\\[ID]\\MQL5\\\r\n```\r\n\r\n**Step 3: Compile**\r\n- Open MetaEditor (F4 in MT5)\r\n- Open `Experts/EA_SCALPER_XAUUSD.mq5`\r\n- Press F7 to compile\r\n- Fix any path issues if errors appear\r\n\r\n**Step 4: Attach to Chart**\r\n- Open XAUUSD M5 chart\r\n- Drag EA from Navigator to chart\r\n- Enable \"Allow Algo Trading\"\r\n- Configure inputs (start with defaults)\r\n\r\n**Step 5: Monitor**\r\n- Check Experts tab for logs\r\n- If no trades: check Journal for filter reasons\r\n- Normal to wait hours for valid setup!\r\n\r\n### Option B: Study & Learn (For Developers)\r\n\r\n**Step 1: Clone Repository**\r\n```bash\r\ngit clone https://github.com/francomascareloai/EA_SCALPER_XAUUSD.git\r\n```\r\n\r\n**Step 2: Explore Structure**\r\n```\r\nStart here:\r\nâ”œâ”€â”€ MQL5/Include/EA_SCALPER/INDEX.md     # Architecture documentation\r\nâ”œâ”€â”€ MQL5/Experts/EA_SCALPER_XAUUSD.mq5   # Main EA (read OnTick flow)\r\nâ”œâ”€â”€ DOCS/                                 # Detailed documentation\r\nâ””â”€â”€ nautilus_gold_scalper/               # Python implementation\r\n```\r\n\r\n**Step 3: Key Files to Study**\r\n\r\n| File | What You'll Learn |\r\n|------|-------------------|\r\n| `Analysis/CRegimeDetector.mqh` | Hurst Exponent, Shannon Entropy |\r\n| `Analysis/EliteOrderBlock.mqh` | SMC Order Block detection |\r\n| `Analysis/CMTFManager.mqh` | Multi-timeframe architecture |\r\n| `Risk/FTMO_RiskManager.mqh` | Prop firm risk management |\r\n| `Bridge/COnnxBrain.mqh` | ML/ONNX integration in MQL5 |\r\n\r\n---\r\n\r\n## For Students & Researchers\r\n\r\n### How to Compile MQL5 Files\r\n\r\n**Using MetaEditor (GUI):**\r\n1. Open MetaTrader 5 â†’ Press F4 (opens MetaEditor)\r\n2. File â†’ Open â†’ Navigate to `EA_SCALPER_XAUUSD.mq5`\r\n3. Press F7 to compile\r\n4. Check \"Errors\" tab at bottom\r\n\r\n**Using Command Line (Advanced):**\r\n```powershell\r\n# Path to MetaEditor\r\n$metaeditor = \"C:\\Program Files\\MetaTrader 5\\metaeditor64.exe\"\r\n\r\n# Compile with includes\r\n& $metaeditor /compile:\"MQL5\\Experts\\EA_SCALPER_XAUUSD.mq5\" /inc:\"MQL5\" /log\r\n\r\n# Check log for errors\r\nGet-Content \"MQL5\\Experts\\EA_SCALPER_XAUUSD.log\"\r\n```\r\n\r\n### Common Compilation Errors\r\n\r\n| Error | Cause | Fix |\r\n|-------|-------|-----|\r\n| `'file.mqh' - file not found` | Include path wrong | Check file exists in `Include/EA_SCALPER/` |\r\n| `'CClassName' - undeclared identifier` | Missing #include | Add the required include at top of file |\r\n| `'OnTick' - function already defined` | Duplicate EA | Only one EA per compilation |\r\n\r\n### Understanding the Code Flow\r\n\r\n```\r\nOnInit()                    # EA starts\r\n    â”‚\r\n    â”œâ”€â”€ Initialize modules\r\n    â”œâ”€â”€ Load ONNX model\r\n    â””â”€â”€ Setup risk parameters\r\n    \r\nOnTick()                    # Every price change\r\n    â”‚\r\n    â”œâ”€â”€ Gate 1: Check emergency mode\r\n    â”œâ”€â”€ Gate 2: Check risk limits\r\n    â”œâ”€â”€ Gate 3: Check session (London/NY)\r\n    â”œâ”€â”€ Gate 4: Check news filter\r\n    â”œâ”€â”€ Gate 5: Check regime (Hurst/Entropy)\r\n    â”œâ”€â”€ Gate 6: Check H1 trend direction\r\n    â”œâ”€â”€ Gate 7: Check structure (BOS/CHoCH)\r\n    â”œâ”€â”€ Gate 8: Check MTF confirmation\r\n    â”œâ”€â”€ Gate 9: Calculate confluence score\r\n    â”œâ”€â”€ Gate 10: Optimize entry\r\n    â”‚\r\n    â””â”€â”€ If ALL gates pass â†’ Execute Trade\r\n    \r\nOnTimer()                   # Every second\r\n    â”‚\r\n    â”œâ”€â”€ Update regime metrics\r\n    â”œâ”€â”€ Manage open positions\r\n    â””â”€â”€ Check partial TPs\r\n```\r\n\r\n---\r\n\r\n## System Architecture\r\n\r\n```\r\nâ”Œâ”€â”€â”€â”€â”€â”€â”€â”€â”€â”€â”€â”€â”€â”€â”€â”€â”€â”€â”€â”€â”€â”€â”€â”€â”€â”€â”€â”€â”€â”€â”€â”€â”€â”€â”€â”€â”€â”€â”€â”€â”€â”€â”€â”€â”€â”€â”€â”€â”€â”€â”€â”€â”€â”€â”€â”€â”€â”€â”€â”€â”€â”€â”€â”€â”€â”€â”€â”€â”€â”€â”€â”€â”€â”€â”€â”€â”€â”\r\nâ”‚                    EA_SCALPER_XAUUSD v3.30 ARCHITECTURE                     â”‚\r\nâ”œâ”€â”€â”€â”€â”€â”€â”€â”€â”€â”€â”€â”€â”€â”€â”€â”€â”€â”€â”€â”€â”€â”€â”€â”€â”€â”€â”€â”€â”€â”€â”€â”€â”€â”€â”€â”€â”€â”€â”€â”€â”€â”€â”€â”€â”€â”€â”€â”€â”€â”€â”€â”€â”€â”€â”€â”€â”€â”€â”€â”€â”€â”€â”€â”€â”€â”€â”€â”€â”€â”€â”€â”€â”€â”€â”€â”€â”€â”¤\r\nâ”‚                                                                             â”‚\r\nâ”‚   â”Œâ”€â”€â”€â”€â”€â”€â”€â”€â”€â”€â”€â”€â”€â”    â”Œâ”€â”€â”€â”€â”€â”€â”€â”€â”€â”€â”€â”€â”€â”    â”Œâ”€â”€â”€â”€â”€â”€â”€â”€â”€â”€â”€â”€â”€â”    â”Œâ”€â”€â”€â”€â”€â”€â”€â”€â”€â”€â”€â”€â”€â” â”‚\r\nâ”‚   â”‚   H1 (HTF)  â”‚â”€â”€â”€â–¶â”‚  M15 (MTF)  â”‚â”€â”€â”€â–¶â”‚  M5 (LTF)   â”‚â”€â”€â”€â–¶â”‚ ORDER FLOW  â”‚ â”‚\r\nâ”‚   â”‚   FILTER    â”‚    â”‚   ZONES     â”‚    â”‚  EXECUTION  â”‚    â”‚ CONFIRMATIONâ”‚ â”‚\r\nâ”‚   â””â”€â”€â”€â”€â”€â”€â”€â”€â”€â”€â”€â”€â”€â”˜    â””â”€â”€â”€â”€â”€â”€â”€â”€â”€â”€â”€â”€â”€â”˜    â””â”€â”€â”€â”€â”€â”€â”€â”€â”€â”€â”€â”€â”€â”˜    â””â”€â”€â”€â”€â”€â”€â”€â”€â”€â”€â”€â”€â”€â”˜ â”‚\r\nâ”‚         â”‚                  â”‚                  â”‚                  â”‚         â”‚\r\nâ”‚         â–¼                  â–¼                  â–¼                  â–¼         â”‚\r\nâ”‚   â”Œâ”€â”€â”€â”€â”€â”€â”€â”€â”€â”€â”€â”€â”€â”€â”€â”€â”€â”€â”€â”€â”€â”€â”€â”€â”€â”€â”€â”€â”€â”€â”€â”€â”€â”€â”€â”€â”€â”€â”€â”€â”€â”€â”€â”€â”€â”€â”€â”€â”€â”€â”€â”€â”€â”€â”€â”€â”€â”€â”€â”€â”€â”€â”€â”€â”€â”€â”€â”€â”€â”  â”‚\r\nâ”‚   â”‚                    CONFLUENCE SCORER (0-100)                        â”‚  â”‚\r\nâ”‚   â”‚   Combines: Trend + Structure + OB + FVG + Sweep + Regime + Delta   â”‚  â”‚\r\nâ”‚   â””â”€â”€â”€â”€â”€â”€â”€â”€â”€â”€â”€â”€â”€â”€â”€â”€â”€â”€â”€â”€â”€â”€â”€â”€â”€â”€â”€â”€â”€â”€â”€â”€â”€â”€â”€â”€â”€â”€â”€â”€â”€â”€â”€â”€â”€â”€â”€â”€â”€â”€â”€â”€â”€â”€â”€â”€â”€â”€â”€â”€â”€â”€â”€â”€â”€â”€â”€â”€â”€â”˜  â”‚\r\nâ”‚                                    â”‚                                        â”‚\r\nâ”‚                                    â–¼                                        â”‚\r\nâ”‚   â”Œâ”€â”€â”€â”€â”€â”€â”€â”€â”€â”€â”€â”€â”€â”€â”€â”€â”€â”€â”€â”€â”€â”€â”€â”€â”€â”€â”€â”€â”€â”€â”€â”€â”€â”€â”€â”€â”€â”€â”€â”€â”€â”€â”€â”€â”€â”€â”€â”€â”€â”€â”€â”€â”€â”€â”€â”€â”€â”€â”€â”€â”€â”€â”€â”€â”€â”€â”€â”€â”€â”  â”‚\r\nâ”‚   â”‚                    10-GATE VALIDATION SYSTEM                         â”‚  â”‚\r\nâ”‚   â”‚   Gate 1: Emergency  â”‚  Gate 6: MTF Direction                       â”‚  â”‚\r\nâ”‚   â”‚   Gate 2: Risk       â”‚  Gate 7: Structure/Signal                    â”‚  â”‚\r\nâ”‚   â”‚   Gate 3: Session    â”‚  Gate 8: MTF Confirmation                    â”‚  â”‚\r\nâ”‚   â”‚   Gate 4: News       â”‚  Gate 9: Confluence Score                    â”‚  â”‚\r\nâ”‚   â”‚   Gate 5: Regime     â”‚  Gate 10: Entry Optimization                 â”‚  â”‚\r\nâ”‚   â””â”€â”€â”€â”€â”€â”€â”€â”€â”€â”€â”€â”€â”€â”€â”€â”€â”€â”€â”€â”€â”€â”€â”€â”€â”€â”€â”€â”€â”€â”€â”€â”€â”€â”€â”€â”€â”€â”€â”€â”€â”€â”€â”€â”€â”€â”€â”€â”€â”€â”€â”€â”€â”€â”€â”€â”€â”€â”€â”€â”€â”€â”€â”€â”€â”€â”€â”€â”€â”€â”˜  â”‚\r\nâ”‚                                    â”‚                                        â”‚\r\nâ”‚                                    â–¼                                        â”‚\r\nâ”‚   â”Œâ”€â”€â”€â”€â”€â”€â”€â”€â”€â”€â”€â”€â”€â”€â”€â”€â”€â”€â”€â”€â”€â”€â”€â”€â”€â”€â”€â”€â”€â”€â”€â”€â”€â”€â”€â”€â”€â”€â”€â”€â”€â”€â”€â”€â”€â”€â”€â”€â”€â”€â”€â”€â”€â”€â”€â”€â”€â”€â”€â”€â”€â”€â”€â”€â”€â”€â”€â”€â”€â”  â”‚\r\nâ”‚   â”‚                    TRADE EXECUTION                                   â”‚  â”‚\r\nâ”‚   â”‚   Entry: Optimized â”‚ SL: Structure-based â”‚ TP: Partial (40/30/30)   â”‚  â”‚\r\nâ”‚   â””â”€â”€â”€â”€â”€â”€â”€â”€â”€â”€â”€â”€â”€â”€â”€â”€â”€â”€â”€â”€â”€â”€â”€â”€â”€â”€â”€â”€â”€â”€â”€â”€â”€â”€â”€â”€â”€â”€â”€â”€â”€â”€â”€â”€â”€â”€â”€â”€â”€â”€â”€â”€â”€â”€â”€â”€â”€â”€â”€â”€â”€â”€â”€â”€â”€â”€â”€â”€â”€â”˜  â”‚\r\nâ”‚                                                                             â”‚\r\nâ””â”€â”€â”€â”€â”€â”€â”€â”€â”€â”€â”€â”€â”€â”€â”€â”€â”€â”€â”€â”€â”€â”€â”€â”€â”€â”€â”€â”€â”€â”€â”€â”€â”€â”€â”€â”€â”€â”€â”€â”€â”€â”€â”€â”€â”€â”€â”€â”€â”€â”€â”€â”€â”€â”€â”€â”€â”€â”€â”€â”€â”€â”€â”€â”€â”€â”€â”€â”€â”€â”€â”€â”€â”€â”€â”€â”€â”€â”˜\r\n```\r\n\r\n---\r\n\r\n## Trading Strategies\r\n\r\n### Strategy 1: SMC Scalping (Primary)\r\n\r\n```\r\n                BULLISH ORDER BLOCK                    BEARISH ORDER BLOCK\r\n                \r\n                        â”‚ Rally                              â”‚ Drop\r\n                        â”‚   â†‘                                â”‚   â†“\r\n                     â”Œâ”€â”€â”´â”€â”€â”€â”´â”€â”€â”                          â”Œâ”€â”€â”´â”€â”€â”€â”´â”€â”€â”\r\n              â•â•â•â•â•â•â–¶â”‚  ENTRY  â”‚â—€â•â•â•â•â•â•            â•â•â•â•â•â•â–¶â”‚  ENTRY  â”‚â—€â•â•â•â•â•â•\r\n                     â”‚  ZONE   â”‚                          â”‚  ZONE   â”‚\r\n                     â””â”€â”€â”€â”€â”€â”€â”€â”€â”€â”˜                          â””â”€â”€â”€â”€â”€â”€â”€â”€â”€â”˜\r\n                     Last Down                            Last Up\r\n                     Candle                               Candle\r\n```\r\n\r\n| Feature | Description |\r\n|---------|-------------|\r\n| **Entry** | Retracement to Order Block (70% level) |\r\n| **SL** | Below/Above OB with ATR buffer |\r\n| **TP** | 1:2 to 1:3 Risk-Reward |\r\n| **Filter** | Only trade fresh OBs (first touch) |\r\n\r\n### Strategy 2: Fair Value Gap (FVG) Trading\r\n\r\n```\r\n              BULLISH FVG                         BEARISH FVG\r\n              \r\n           Candle 3 â”€â”€â–º  â”Œâ”€â”€â”€â”                    â”Œâ”€â”€â”€â”  â—„â”€â”€ Candle 1\r\n                         â”‚   â”‚                    â”‚   â”‚\r\n           GAP â”€â”€â”€â”€â”€â”€â”€â”€â–º â”‚â–‘â–‘â–‘â”‚ â—„â”€â”€ 50% Fill       â”‚â–‘â–‘â–‘â”‚ â—„â”€â”€ GAP\r\n                         â”‚â–‘â–‘â–‘â”‚     Entry          â”‚â–‘â–‘â–‘â”‚\r\n                         â””â”€â”€â”€â”˜                    â””â”€â”€â”€â”˜\r\n           Candle 1 â”€â”€â–º  â”Œâ”€â”€â”€â”                    â”Œâ”€â”€â”€â”  â—„â”€â”€ Candle 3\r\n                         â”‚   â”‚                    â”‚   â”‚\r\n                         â””â”€â”€â”€â”˜                    â””â”€â”€â”€â”˜\r\n```\r\n\r\n| Feature | Description |\r\n|---------|-------------|\r\n| **Entry** | 50% FVG fill (optimal R:R) |\r\n| **Target** | Opposite side of FVG |\r\n| **Best** | FVG + OB confluence |\r\n\r\n### Strategy 3: Liquidity Sweep + Reversal\r\n\r\n```\r\n              LIQUIDITY SWEEP PATTERN\r\n              \r\n              BSL (Buy-Side Liquidity) â•â•â•â•â•â•â•â•â•â•â•â•â•â•â•â•â•â•â•\r\n                          â”‚\r\n                   â”Œâ”€â”€â”€â”€â”€â”€â”¼â”€â”€â”€â”€â”€â”€â”\r\n                   â”‚      â”‚      â”‚\r\n                   â”‚   SWEEP â”€â”€â”€â”€â”¼â”€â”€â”€â”€ Price breaks above\r\n                   â”‚      â”‚      â”‚     grabs stops\r\n                   â”‚      â”‚      â”‚     and REVERSES\r\n                   â”‚      â–¼      â”‚\r\n                   â”‚   â•â•â•â•â•â•    â”‚\r\n                   â”‚             â”‚\r\n              SSL (Sell-Side Liquidity) â•â•â•â•â•â•â•â•â•â•â•â•â•â•â•â•â•â•â•\r\n```\r\n\r\n| Feature | Description |\r\n|---------|-------------|\r\n| **Setup** | Equal highs/lows (liquidity pools) |\r\n| **Trigger** | Price sweeps level and rejects |\r\n| **Entry** | After confirmation candle |\r\n| **Target** | Opposite liquidity pool |\r\n\r\n### Strategy 4: AMD Cycle (Accumulation â†’ Manipulation â†’ Distribution)\r\n\r\n```\r\n         ACCUMULATION              MANIPULATION              DISTRIBUTION\r\n         \r\n         â”Œâ”€â”€â”€â”€â”€â”€â”€â”€â”€â”€â”€â”€â”€â”          â”Œâ”€â”€â”€â”€â”€â”€â”€â”€â”€â”€â”€â”€â”€â”          â”Œâ”€â”€â”€â”€â”€â”€â”€â”€â”€â”€â”€â”€â”€â”\r\n         â”‚ â•â•â•â•â•â•â•â•â•â•â• â”‚          â”‚     â†‘ Fake  â”‚          â”‚         â†—   â”‚\r\n         â”‚ â•â•â•â•â•â•â•â•â•â•â• â”‚    â”€â”€â–¶   â”‚ â•â•â•â•â•± Break â”‚    â”€â”€â–¶   â”‚       â†—     â”‚\r\n         â”‚  Range      â”‚          â”‚    â†“        â”‚          â”‚     â†—  REAL â”‚\r\n         â”‚  (Wait)     â”‚          â”‚  (Prepare)  â”‚          â”‚   â†—  MOVE   â”‚\r\n         â””â”€â”€â”€â”€â”€â”€â”€â”€â”€â”€â”€â”€â”€â”˜          â””â”€â”€â”€â”€â”€â”€â”€â”€â”€â”€â”€â”€â”€â”˜          â””â”€â”€â”€â”€â”€â”€â”€â”€â”€â”€â”€â”€â”€â”˜\r\n              âŒ                        âš ï¸                        âœ…\r\n           Don't Trade             Get Ready                   ENTER!\r\n```\r\n\r\n---\r\n\r\n## Analysis Modules (MQL5)\r\n\r\n### Core Analysis Modules\r\n\r\n| Module | Purpose | Key Features |\r\n|--------|---------|--------------|\r\n| **CMTFManager** | Multi-Timeframe Coordination | H1 trend filter, M15 zones, M5 execution |\r\n| **CStructureAnalyzer** | Market Structure | BOS, CHoCH, Swing Points detection |\r\n| **EliteOrderBlock** | Order Block Detection | Quality scoring (0-100), freshness tracking |\r\n| **EliteFVG** | Fair Value Gap Detection | Fill percentage, state management |\r\n| **CLiquiditySweepDetector** | Liquidity Analysis | BSL/SSL pools, sweep detection |\r\n| **CRegimeDetector** | Market Regime | Hurst Exponent + Shannon Entropy |\r\n| **CAMDCycleTracker** | AMD Phase Detection | Accumulation/Manipulation/Distribution |\r\n| **CFootprintAnalyzer** | Order Flow Analysis | Delta, Imbalance, Absorption |\r\n\r\n### Regime Detection Matrix\r\n\r\n```\r\nâ”Œâ”€â”€â”€â”€â”€â”€â”€â”€â”€â”€â”€â”€â”€â”€â”€â”€â”€â”¬â”€â”€â”€â”€â”€â”€â”€â”€â”€â”€â”€â”€â”€â”€â”€â”¬â”€â”€â”€â”€â”€â”€â”€â”€â”€â”€â”€â”€â”€â”€â”€â”\r\nâ”‚                 â”‚ Entropy < 1.5 â”‚ Entropy >= 1.5â”‚\r\nâ”‚                 â”‚  (Low Noise)  â”‚ (High Noise)  â”‚\r\nâ”œâ”€â”€â”€â”€â”€â”€â”€â”€â”€â”€â”€â”€â”€â”€â”€â”€â”€â”¼â”€â”€â”€â”€â”€â”€â”€â”€â”€â”€â”€â”€â”€â”€â”€â”¼â”€â”€â”€â”€â”€â”€â”€â”€â”€â”€â”€â”€â”€â”€â”€â”¤\r\nâ”‚  Hurst > 0.55   â”‚ âœ… TRENDING   â”‚ âš ï¸ NOISY      â”‚\r\nâ”‚  (Persistent)   â”‚ Size: 100%    â”‚ Size: 50%     â”‚\r\nâ”œâ”€â”€â”€â”€â”€â”€â”€â”€â”€â”€â”€â”€â”€â”€â”€â”€â”€â”¼â”€â”€â”€â”€â”€â”€â”€â”€â”€â”€â”€â”€â”€â”€â”€â”¼â”€â”€â”€â”€â”€â”€â”€â”€â”€â”€â”€â”€â”€â”€â”€â”¤\r\nâ”‚  Hurst < 0.45   â”‚ âœ… REVERTING  â”‚ âš ï¸ NOISY      â”‚\r\nâ”‚  (Mean-Revert)  â”‚ Size: 100%    â”‚ Size: 50%     â”‚\r\nâ”œâ”€â”€â”€â”€â”€â”€â”€â”€â”€â”€â”€â”€â”€â”€â”€â”€â”€â”¼â”€â”€â”€â”€â”€â”€â”€â”€â”€â”€â”€â”€â”€â”€â”€â”¼â”€â”€â”€â”€â”€â”€â”€â”€â”€â”€â”€â”€â”€â”€â”€â”¤\r\nâ”‚  Hurst â‰ˆ 0.50   â”‚ âŒ RANDOM     â”‚ âŒ RANDOM     â”‚\r\nâ”‚  (Random Walk)  â”‚ NO TRADE      â”‚ NO TRADE      â”‚\r\nâ””â”€â”€â”€â”€â”€â”€â”€â”€â”€â”€â”€â”€â”€â”€â”€â”€â”€â”´â”€â”€â”€â”€â”€â”€â”€â”€â”€â”€â”€â”€â”€â”€â”€â”´â”€â”€â”€â”€â”€â”€â”€â”€â”€â”€â”€â”€â”€â”€â”€â”˜\r\n```\r\n\r\n### Order Flow Analysis (Footprint)\r\n\r\n```\r\n   TRADITIONAL CANDLE              FOOTPRINT CHART\r\n   \r\n        â”Œâ”€â”€â”€â”                   Price â”‚ Bid x Ask â”‚ Delta\r\n        â”‚   â”‚                   â”€â”€â”€â”€â”€â”€â”¼â”€â”€â”€â”€â”€â”€â”€â”€â”€â”€â”€â”¼â”€â”€â”€â”€â”€â”€\r\n        â”‚   â”‚                   2650.5â”‚ 120 x 450 â”‚ +330 [BUY IMB]\r\n        â”‚   â”‚                   2650.0â”‚ 280 x 310 â”‚ +30  â—„â”€ POC\r\n        â”‚   â”‚                   2649.5â”‚ 350 x 180 â”‚ -170 [SELL IMB]\r\n        â””â”€â”€â”€â”˜                   2649.0â”‚ 190 x 220 â”‚ +30\r\n                                2648.5â”‚  90 x 150 â”‚ +60\r\n```\r\n\r\n| Pattern | Detection | Meaning |\r\n|---------|-----------|---------|\r\n| **Stacked Buy Imbalance** | 3+ consecutive buy imbalances | Strong support |\r\n| **Stacked Sell Imbalance** | 3+ consecutive sell imbalances | Strong resistance |\r\n| **Buy Absorption** | High volume + delta ~0 on drop | Buyers absorbing sells |\r\n| **Sell Absorption** | High volume + delta ~0 on rise | Sellers absorbing buys |\r\n| **Unfinished Auction** | Close=High/Low + delta confirms | Continuation expected |\r\n\r\n---\r\n\r\n## Risk Management\r\n\r\n### Safety Layer Architecture\r\n\r\n```\r\nâ”Œâ”€â”€â”€â”€â”€â”€â”€â”€â”€â”€â”€â”€â”€â”€â”€â”€â”€â”€â”€â”€â”€â”€â”€â”€â”€â”€â”€â”€â”€â”€â”€â”€â”€â”€â”€â”€â”€â”€â”€â”€â”€â”€â”€â”€â”€â”€â”€â”€â”€â”€â”€â”€â”€â”€â”€â”€â”€â”€â”€â”€â”€â”€â”€â”€â”€â”€â”€â”€â”€â”€â”€â”€â”€â”€â”€â”€â”€â”\r\nâ”‚                           SAFETY LAYER                                       â”‚\r\nâ”œâ”€â”€â”€â”€â”€â”€â”€â”€â”€â”€â”€â”€â”€â”€â”€â”€â”€â”€â”€â”€â”€â”€â”€â”€â”€â”€â”€â”€â”€â”€â”€â”€â”€â”€â”€â”€â”€â”€â”€â”€â”€â”€â”€â”€â”€â”€â”€â”€â”€â”€â”€â”€â”€â”€â”€â”€â”€â”€â”€â”€â”€â”€â”€â”€â”€â”€â”€â”€â”€â”€â”€â”€â”€â”€â”€â”€â”€â”¤\r\nâ”‚                                                                             â”‚\r\nâ”‚   â”Œâ”€â”€â”€â”€â”€â”€â”€â”€â”€â”€â”€â”€â”€â”€â”€â”€â”€â”€â”€â”€â”€â”         â”Œâ”€â”€â”€â”€â”€â”€â”€â”€â”€â”€â”€â”€â”€â”€â”€â”€â”€â”€â”€â”€â”€â”                  â”‚\r\nâ”‚   â”‚   CIRCUIT BREAKER   â”‚         â”‚   SPREAD MONITOR    â”‚                  â”‚\r\nâ”‚   â”œâ”€â”€â”€â”€â”€â”€â”€â”€â”€â”€â”€â”€â”€â”€â”€â”€â”€â”€â”€â”€â”€â”¤         â”œâ”€â”€â”€â”€â”€â”€â”€â”€â”€â”€â”€â”€â”€â”€â”€â”€â”€â”€â”€â”€â”€â”¤                  â”‚\r\nâ”‚   â”‚ Daily DD: 4% â†’ STOP â”‚         â”‚ Normal: 100% size   â”‚                  â”‚\r\nâ”‚   â”‚ Total DD: 8% â†’ CLOSEâ”‚         â”‚ Elevated: 50% size  â”‚                  â”‚\r\nâ”‚   â”‚ 5 Losses â†’ COOLDOWN â”‚         â”‚ High: 25% size      â”‚                  â”‚\r\nâ”‚   â”‚ Emergency â†’ HALT    â”‚         â”‚ Extreme: NO TRADE   â”‚                  â”‚\r\nâ”‚   â””â”€â”€â”€â”€â”€â”€â”€â”€â”€â”€â”€â”€â”€â”€â”€â”€â”€â”€â”€â”€â”€â”˜         â””â”€â”€â”€â”€â”€â”€â”€â”€â”€â”€â”€â”€â”€â”€â”€â”€â”€â”€â”€â”€â”€â”˜                  â”‚\r\nâ”‚                                                                             â”‚\r\nâ””â”€â”€â”€â”€â”€â”€â”€â”€â”€â”€â”€â”€â”€â”€â”€â”€â”€â”€â”€â”€â”€â”€â”€â”€â”€â”€â”€â”€â”€â”€â”€â”€â”€â”€â”€â”€â”€â”€â”€â”€â”€â”€â”€â”€â”€â”€â”€â”€â”€â”€â”€â”€â”€â”€â”€â”€â”€â”€â”€â”€â”€â”€â”€â”€â”€â”€â”€â”€â”€â”€â”€â”€â”€â”€â”€â”€â”€â”˜\r\n```\r\n\r\n### Prop Firm Compliance\r\n\r\n| Rule | Apex | FTMO | Our Buffer | Implementation |\r\n|------|------|------|------------|----------------|\r\n| **Max Drawdown** | 10% trailing | 10% total | 8% | Real-time HWM tracking |\r\n| **Daily Drawdown** | N/A | 5% | 4% | Daily loss circuit breaker |\r\n| **Overnight** | âŒ Prohibited | âœ… Allowed | Auto-close | Time-based closure |\r\n| **Consistency** | 30% max/day | N/A | Monitor | Daily profit cap |\r\n| **Risk/Trade** | 0.5-1% | 0.5-1% | 0.5% | Dynamic position sizing |\r\n\r\n### Position Sizing Formula\r\n\r\n```\r\nLot Size = (Account Equity Ã— Risk%) / (SL Points Ã— Tick Value)\r\n         Ã— Regime Multiplier (0.5 or 1.0)\r\n         Ã— MTF Multiplier (0.5, 0.75, or 1.0)\r\n         Ã— Spread Multiplier (0.25 to 1.0)\r\n```\r\n\r\n---\r\n\r\n## Machine Learning Integration\r\n\r\n### ONNX Brain - Direction Prediction\r\n\r\n```\r\nâ”Œâ”€â”€â”€â”€â”€â”€â”€â”€â”€â”€â”€â”€â”€â”€â”€â”€â”€â”€â”€â”€â”€â”€â”€â”€â”€â”€â”€â”€â”€â”€â”€â”€â”€â”€â”€â”€â”€â”€â”€â”€â”€â”€â”€â”€â”€â”€â”€â”€â”€â”€â”€â”€â”€â”€â”€â”€â”€â”€â”€â”€â”€â”€â”€â”€â”€â”€â”€â”€â”€â”€â”€â”€â”€â”€â”€â”€â”€â”\r\nâ”‚                        ONNX INFERENCE PIPELINE                               â”‚\r\nâ”œâ”€â”€â”€â”€â”€â”€â”€â”€â”€â”€â”€â”€â”€â”€â”€â”€â”€â”€â”€â”€â”€â”€â”€â”€â”€â”€â”€â”€â”€â”€â”€â”€â”€â”€â”€â”€â”€â”€â”€â”€â”€â”€â”€â”€â”€â”€â”€â”€â”€â”€â”€â”€â”€â”€â”€â”€â”€â”€â”€â”€â”€â”€â”€â”€â”€â”€â”€â”€â”€â”€â”€â”€â”€â”€â”€â”€â”€â”¤\r\nâ”‚                                                                             â”‚\r\nâ”‚   FEATURES (15)              MODEL                    OUTPUT                â”‚\r\nâ”‚   â”Œâ”€â”€â”€â”€â”€â”€â”€â”€â”€â”€â”€â”€â”€â”      â”Œâ”€â”€â”€â”€â”€â”€â”€â”€â”€â”€â”€â”€â”€â”         â”Œâ”€â”€â”€â”€â”€â”€â”€â”€â”€â”€â”€â”€â”€â”             â”‚\r\nâ”‚   â”‚ Returns     â”‚      â”‚             â”‚         â”‚             â”‚             â”‚\r\nâ”‚   â”‚ RSI (3 TFs) â”‚      â”‚    LSTM     â”‚         â”‚ P(Bearish)  â”‚             â”‚\r\nâ”‚   â”‚ ATR Norm    â”‚ â”€â”€â”€â–¶ â”‚    MODEL    â”‚ â”€â”€â”€â–¶    â”‚ P(Bullish)  â”‚             â”‚\r\nâ”‚   â”‚ Hurst       â”‚      â”‚   (ONNX)    â”‚         â”‚             â”‚             â”‚\r\nâ”‚   â”‚ Entropy     â”‚      â”‚             â”‚         â”‚ If > 0.65   â”‚             â”‚\r\nâ”‚   â”‚ Session     â”‚      â””â”€â”€â”€â”€â”€â”€â”€â”€â”€â”€â”€â”€â”€â”˜         â”‚ = CONFIRM   â”‚             â”‚\r\nâ”‚   â”‚ ...         â”‚           < 5ms              â””â”€â”€â”€â”€â”€â”€â”€â”€â”€â”€â”€â”€â”€â”˜             â”‚\r\nâ”‚   â””â”€â”€â”€â”€â”€â”€â”€â”€â”€â”€â”€â”€â”€â”˜                                                          â”‚\r\nâ”‚                                                                             â”‚\r\nâ””â”€â”€â”€â”€â”€â”€â”€â”€â”€â”€â”€â”€â”€â”€â”€â”€â”€â”€â”€â”€â”€â”€â”€â”€â”€â”€â”€â”€â”€â”€â”€â”€â”€â”€â”€â”€â”€â”€â”€â”€â”€â”€â”€â”€â”€â”€â”€â”€â”€â”€â”€â”€â”€â”€â”€â”€â”€â”€â”€â”€â”€â”€â”€â”€â”€â”€â”€â”€â”€â”€â”€â”€â”€â”€â”€â”€â”€â”˜\r\n```\r\n\r\n### 15 Model Features\r\n\r\n| # | Feature | Calculation |\r\n|---|---------|-------------|\r\n| 1 | Returns | (close - prev) / prev |\r\n| 2 | Log Returns | log(close / prev) |\r\n| 3 | Range % | (high - low) / close |\r\n| 4-6 | RSI (M5/M15/H1) | RSI(14) / 100 |\r\n| 7 | ATR Normalized | ATR(14) / close |\r\n| 8 | MA Distance | (close - MA20) / MA20 |\r\n| 9 | BB Position | (close - mid) / width |\r\n| 10 | Hurst | Rolling Hurst(100) |\r\n| 11 | Entropy | Rolling Entropy(100) / 4 |\r\n| 12 | Session | 0=Asia, 1=London, 2=NY |\r\n| 13-14 | Hour Encoding | sin/cos(2Ï€ Ã— hour / 24) |\r\n| 15 | OB Distance | Distance to OB / ATR |\r\n\r\n---\r\n\r\n## NautilusTrader Migration (Python)\r\n\r\nWe are actively migrating to **[NautilusTrader](https://nautilustrader.io)** - a high-performance algorithmic trading platform.\r\n\r\n### Why NautilusTrader?\r\n\r\n| Feature | Benefit |\r\n|---------|---------|\r\n| **Event-Driven** | Realistic backtesting without look-ahead bias |\r\n| **High Performance** | Cython core for institutional-grade speed |\r\n| **Multi-Venue** | Trade futures on Tradovate (Apex) |\r\n| **Unified Code** | Same code for backtest and live |\r\n| **Python Ecosystem** | Full ML/AI libraries access |\r\n\r\n### Migration Progress\r\n\r\n```\r\nnautilus_gold_scalper/\r\nâ”œâ”€â”€ src/\r\nâ”‚   â”œâ”€â”€ strategies/          # Trading strategies\r\nâ”‚   â”œâ”€â”€ indicators/          # Custom indicators\r\nâ”‚   â”œâ”€â”€ signals/             # Signal generators\r\nâ”‚   â”œâ”€â”€ risk/                # Risk management\r\nâ”‚   â”œâ”€â”€ ml/                  # Machine learning\r\nâ”‚   â”œâ”€â”€ execution/           # Trade execution\r\nâ”‚   â””â”€â”€ core/                # Core definitions\r\nâ”œâ”€â”€ scripts/                 # Backtest runners\r\nâ”œâ”€â”€ tests/                   # Unit tests\r\nâ””â”€â”€ data/                    # Historical data\r\n```\r\n\r\n### Modules Status\r\n\r\n| Module | MQL5 | Python | Status |\r\n|--------|------|--------|--------|\r\n| Session Filter | âœ… | âœ… | **Migrated** |\r\n| Regime Detector | âœ… | âœ… | **Migrated** |\r\n| Order Block | âœ… | âœ… | **Migrated** |\r\n| FVG Detector | âœ… | âœ… | **Migrated** |\r\n| Liquidity Sweep | âœ… | âœ… | **Migrated** |\r\n| Footprint Analyzer | âœ… | âœ… | **Migrated** |\r\n| Confluence Scorer | âœ… | âœ… | **Migrated** |\r\n| Risk Manager | âœ… | âœ… | **Migrated** |\r\n| Trade Manager | âœ… | ğŸ”„ | In Progress |\r\n| SMC Strategy | âœ… | ğŸ”„ | In Progress |\r\n\r\n---\r\n\r\n## Project Structure\r\n\r\n```\r\nEA_SCALPER_XAUUSD/\r\nâ”‚\r\nâ”œâ”€â”€ MQL5/                           # MetaTrader 5 Source\r\nâ”‚   â”œâ”€â”€ Experts/                    # Main EA\r\nâ”‚   â”‚   â””â”€â”€ EA_SCALPER_XAUUSD.mq5   # Entry point\r\nâ”‚   â”œâ”€â”€ Include/EA_SCALPER/         # Modules\r\nâ”‚   â”‚   â”œâ”€â”€ Analysis/               # Technical analysis\r\nâ”‚   â”‚   â”œâ”€â”€ Signal/                 # Signal generation\r\nâ”‚   â”‚   â”œâ”€â”€ Risk/                   # Risk management\r\nâ”‚   â”‚   â”œâ”€â”€ Execution/              # Trade execution\r\nâ”‚   â”‚   â”œâ”€â”€ Bridge/                 # External integrations\r\nâ”‚   â”‚   â”œâ”€â”€ Safety/                 # Circuit breakers\r\nâ”‚   â”‚   â””â”€â”€ Core/                   # Core definitions\r\nâ”‚   â””â”€â”€ Models/                     # ONNX models\r\nâ”‚\r\nâ”œâ”€â”€ nautilus_gold_scalper/          # NautilusTrader (Python)\r\nâ”‚   â”œâ”€â”€ src/                        # Source code\r\nâ”‚   â”œâ”€â”€ tests/                      # Unit tests\r\nâ”‚   â””â”€â”€ scripts/                    # Backtest scripts\r\nâ”‚\r\nâ”œâ”€â”€ scripts/                        # Analysis tools\r\nâ”‚   â”œâ”€â”€ oracle/                     # WFA, Monte Carlo\r\nâ”‚   â””â”€â”€ forge/                      # Code analysis\r\nâ”‚\r\nâ”œâ”€â”€ models/                         # ML models\r\nâ”œâ”€â”€ data/                           # Market data\r\nâ””â”€â”€ DOCS/                           # Documentation\r\n```\r\n\r\n---\r\n\r\n## Target Performance (Theoretical)\r\n\r\n> **âš ï¸ IMPORTANT: These are THEORETICAL targets, not actual results!**\r\n> \r\n> The system is still in development. These numbers represent design goals, \r\n> not guaranteed or backtested performance. Real results may vary significantly.\r\n\r\n| Metric | Target | Notes |\r\n|--------|--------|-------|\r\n| **Win Rate** | 65-75% | If MTF + SMC + ML confluence works as designed |\r\n| **Average R:R** | 2.0-2.5 | Depends on entry optimization |\r\n| **Profit Factor** | 2.0+ | Theoretical based on above |\r\n| **Max Drawdown** | < 8% | Prop firm buffer requirement |\r\n| **Trades/Day** | 3-8 | Quality over quantity |\r\n\r\n---\r\n\r\n## Roadmap\r\n\r\n### Current Phase: Bug Fixing & Stabilization\r\n\r\n- [x] Fix duplicate struct definitions\r\n- [x] Remove deprecated MQL5 functions\r\n- [ ] Adjust filter strictness (too few trades)\r\n- [ ] Improve ONNX model loading reliability\r\n- [ ] Add more detailed logging for debugging\r\n- [ ] Complete backtesting validation\r\n\r\n### Next Phase: Optimization\r\n\r\n- [ ] Walk-Forward Analysis (WFA)\r\n- [ ] Monte Carlo simulation\r\n- [ ] Parameter optimization\r\n- [ ] Reduce false signals\r\n\r\n### Future Phase: Production Ready\r\n\r\n- [ ] 3+ months demo testing\r\n- [ ] Statistical validation complete\r\n- [ ] Documentation complete\r\n- [ ] Production release\r\n\r\n---\r\n\r\n## Requirements\r\n\r\n- **Platform**: MetaTrader 5 (build 3000+)\r\n- **Broker**: Any with XAUUSD (low spread < 30 points preferred)\r\n- **Account**: $50,000+ recommended for proper position sizing\r\n- **VPS**: Recommended for 24/5 operation (low latency)\r\n- **Python**: 3.10+ (for NautilusTrader version)\r\n- **OS**: Windows 10/11 (for MQL5), Linux/Mac (for Python)\r\n\r\n---\r\n\r\n## Disclaimer\r\n\r\n> **âš ï¸ IMPORTANT LEGAL DISCLAIMER**\r\n\r\nThis is a **personal project** shared for **educational purposes only**. \r\n\r\n**Trading involves substantial risk of loss and is not suitable for all investors.**\r\n\r\n- Past performance does not guarantee future results\r\n- Use at your own risk\r\n- Always test on demo accounts first\r\n- **I am not responsible for any financial losses**\r\n- This is NOT financial advice\r\n- Do NOT use real money until you fully understand the system\r\n\r\n---\r\n\r\n## Contact & Contributions\r\n\r\nThis repository is maintained by **Franco** as a personal trading automation project.\r\n\r\n**Telegram**: [@novtelfran](https://t.me/novtelfran)\r\n\r\nQuestions? Want to contribute? Found a bug? Feel free to reach out!\r\n\r\nIf you find this useful, give it a â­ star!\r\n\r\n---\r\n\r\n## Version History\r\n\r\n| Version | Date | Changes |\r\n|---------|------|---------|\r\n| **3.30** | 2025-12 | Order Flow Edition: Footprint, Imbalance, Absorption |\r\n| **3.20** | 2025-11 | MTF Architecture (H1+M15+M5) |\r\n| **3.10** | 2025-11 | Entry Optimizer SL limits |\r\n| **3.00** | 2025-10 | Singularity Edition (ML/ONNX) |\r\n| **2.00** | 2025-09 | SMC Core Modules |\r\n| **1.00** | 2025-08 | Initial Release |\r\n\r\n---\r\n\r\n*\"The market is never wrong. Opinions are.\"* - Jesse Livermore\r\n\r\n---\r\n\r\n### Keywords\r\n`algorithmic-trading` `xauusd` `gold-trading` `mql5` `metatrader5` `expert-advisor` `prop-firm` `apex-trader-funding` `ftmo` `nautilustrader` `python-trading` `smart-money-concepts` `order-flow` `machine-learning` `onnx` `quantitative-trading` `automated-trading` `scalping` `forex` `futures` `trading-bot` `quant` `financial-analysis` `institutional-trading` `footprint-chart`\r\n",
  "installCommand": "git clone https://github.com/francomascareloai/EA_SCALPER_XAUUSD ~/.claude/skills/ea-scalper-xauusd",
  "defaultBranch": "main",
  "hasMarketplaceJson": false,
  "skillPath": "README.md"
}